<?xml version="1.0" encoding="UTF-8"?>
<ac:execute xmlns:ac="http://ebsa.ipt.com/aCloudCommand-1.1" xsi:schemaLocation="http://ebsa.ipt.com/aCloudCommand-1.1 aCloudCommand-1.1.xsd" xmlns:xsi="http://www.w3.org/2001/XMLSchema-instance">
	<ac:EnvironmentContainer  includes=".*" errorStrategy="exit" strategy="merge" command="create">
		<ac:OrganisationNetwork  errorStrategy="exit" includes=".*" strategy="merge" command="create"/>
		<ac:EdgeGateway  errorStrategy="exit" includes=".*" strategy="merge" command="create"/>
		<ac:Environment  includes=".*" errorStrategy="exit" strategy="merge" command="create">
			<ac:options>
				<ac:option name="overwriteEmptyTemplateMachines" value="true"/>
			</ac:options>
			<ac:VirtualMachineContainer  includes=".*" errorStrategy="exit" strategy="merge" command="create">
				<ac:ApplicationNetwork  errorStrategy="exit" includes=".*" strategy="merge" command="create"/>
				<ac:VirtualMachine  errorStrategy="exit" includes=".*" strategy="merge" command="create"/>
			</ac:VirtualMachineContainer>
		</ac:Environment>
	</ac:EnvironmentContainer>
</ac:execute>