<?xml version="1.0" encoding="UTF-8"?>
<!--Sample XML file generated by XMLSpy v2010 rel. 3 sp1 (http://www.altova.com)-->
<ac:execute xsi:schemaLocation="http://ebsa.ipt.com/aCloudCommand-1.1 aCloudCommand-1.1.xsd" xmlns:ac="http://ebsa.ipt.com/aCloudCommand-1.1" xmlns:xsi="http://www.w3.org/2001/XMLSchema-instance">
	<ac:EnvironmentContainer excludes=".*" includes="text" errorStrategy="cleanAndExit" strategy="overwrite" command="confirm">
		<ac:OrganisationNetwork excludes="text" errorStrategy="cleanAndExit" includes="text" strategy="createOnly" command="resume"/>
		<ac:EdgeGateway excludes="text" errorStrategy="continue" includes="text" strategy="merge" command="undeploy"/>
		<ac:Environment  excludes=".*" includes="text" errorStrategy="cleanAndExit" strategy="overwrite" command="confirm">
			<ac:VirtualMachineContainer excludes="text" includes="text" errorStrategy="continue" strategy="overwrite" command="reboot">
				<ac:ApplicationNetwork excludes="text" errorStrategy="exit" includes="text" strategy="createOnly" command="suspend"/>
				<ac:VirtualMachine excludes="text" errorStrategy="cleanAndExit" includes="text" strategy="exists" command="shutdown"/>
			</ac:VirtualMachineContainer>
			<ac:Overrides>
				<ac:override xpath="String" value="String"/>
				<ac:override xpath="String" value="String"/>
			</ac:Overrides>
		</ac:Environment>
	</ac:EnvironmentContainer>
</ac:execute>

