<?xml version="1.0" encoding="UTF-8"?>
<!--Sample XML file generated by XMLSpy v2010 rel. 3 sp1 (http://www.altova.com)-->
<vc:execute xsi:schemaLocation="http://ebsa.ipt.com/VCloudCommand-2.0 aCloudCommand-1.1.xsd" xmlns:vc="http://ebsa.ipt.com/VCloudCommand-2.0" xmlns:xsi="http://www.w3.org/2001/XMLSchema-instance">
	<vc:EnvironmentContainer  includes=".*" errorStrategy="exit" strategy="createOnly" command="create">
		<vc:OrganisationNetwork  errorStrategy="exit" includes=".*" strategy="createOnly" command="create"/>
		<vc:EdgeGateway  errorStrategy="exit" includes=".*" strategy="createOnly" command="create"/>
		<vc:Environment  includes=".*" errorStrategy="exit" strategy="createOnly" command="create">
			<vc:options>
				<vc:option name="overwriteEmptyTemplateMachines" value="String"/>
			</vc:options>
			<vc:VirtualMachineContainer  includes=".*" errorStrategy="exit" strategy="createOnly" command="create">
				<vc:ApplicationNetwork  errorStrategy="exit" includes=".*" strategy="createOnly" command="create"/>
				<vc:VirtualMachine  errorStrategy="exit" includes=".*" strategy="createOnly" command="create"/>
			</vc:VirtualMachineContainer>
		</vc:Environment>
	</vc:EnvironmentContainer>
</vc:execute>